{
  "schema_version": 1,
  "snapshot_version": 1,
  "transaction_version": 1,
  "reconciliation_version": 0,
  "transaction_id": "tx-1",
  "status": "active",
  "balances_known": true,
  "unit": "tokens",
  "ceiling": 100,
  "measurement": "observed",
  "enforcement": "advisory",
  "measurement_source": "fixture-counter",
  "reserves": {
    "coordinator": 10,
    "integration": 10,
    "mandatory_review": 10
  },
  "available": 60,
  "reserved": 40,
  "funded_consumed": 0,
  "funded_reservation_overrun": 0,
  "unfunded_consumed": 0,
  "total_consumed": 0,
  "released": 0,
  "reservations": {
    "reservation-1": {
      "reservation_id": "reservation-1",
      "assignment_id": "assignment-1",
      "logical_teammate_id": "worker-1",
      "kind": "worker",
      "attempt": 1,
      "initial_reserved": 40,
      "active_reserved": 40,
      "funded_consumed": 0,
      "funded_reservation_overrun": 0,
      "unfunded_consumed": 0,
      "released_unused": 0,
      "state": "running",
      "measurement": "observed",
      "reservation_transaction_id": "tx-1",
      "evidence_refs": [
        "work-1"
      ],
      "terminal_evidence": null,
      "retry_of_reservation_id": null
    }
  },
  "history": [],
  "reconciliation_history": [],
  "reset_history": [],
  "applied_event_ids": [],
  "failure_history": []
}
